{
  "schema_version": "1.0",
  "id": "ev-doc-diff",
  "kind": "git_diff",
  "status": "observed",
  "source": {
    "tool": "git",
    "version": "2.51.0",
    "path": null,
    "command_fingerprint": "sha256:example-doc-diff-command",
    "observed_at": "2026-08-28T15:00:00Z"
  },
  "findings": [
    {
      "code": "DOC_ONLY_PATHS",
      "summary": "The diff changes README.md only.",
      "paths": ["README.md"]
    }
  ],
  "data": {
    "added_lines": 4,
    "deleted_lines": 2,
    "binary_files": 0
  },
  "gate_trust": "eligible",
  "limitations": []
}
